{
  "report_version": "1.0",
  "dataset_version": "0.1.0",
  "rules": {
    "applied_while_pending": {
      "problem": "P6",
      "severity": "medium",
      "description": "Message says a change was already made although it still needs the user's confirmation."
    },
    "capability_assumption": {
      "problem": "P2",
      "severity": "medium",
      "description": "Verification relies on a product capability (auto transcription, URL fetch, issuing scrambles, calling endpoints) that may not exist."
    },
    "capacity_mismatch": {
      "problem": "P5",
      "severity": "medium",
      "description": "Planned durations do not fit (or wildly underuse) weekly hours x horizon."
    },
    "change_without_consent": {
      "problem": "P6",
      "severity": "medium",
      "description": "Moderate/major change or removal applied without asking."
    },
    "deadline_change_without_consent": {
      "problem": "P6",
      "severity": "medium",
      "description": "Milestone/goal dates change while requires_user_confirmation is false."
    },
    "en_third_person_pronoun": {
      "problem": "P9",
      "severity": "low",
      "description": "A gendered third-person pronoun in an English output — check it does not refer to the user or to someone whose pronouns are unknown."
    },
    "generic_rationale": {
      "problem": "P1",
      "severity": "low",
      "description": "why_it_matters / reason uses a stock phrase that carries no task-specific reason."
    },
    "novel_quantity": {
      "problem": "P7",
      "severity": "info",
      "description": "A quantity with a unit (hours, weeks, %, money) in user-facing text does not appear in the input; confirm it is derived correctly."
    },
    "past_weekend_day": {
      "problem": "X",
      "severity": "high",
      "description": "Plans a day of 'this weekend' that is already in the past relative to `today`."
    },
    "promises_later_message": {
      "problem": "X",
      "severity": "low",
      "description": "Promises to send something in a later message — requires a product capability."
    },
    "retrieved_memory_leak": {
      "problem": "P8",
      "severity": "high",
      "description": "Distinctive words/numbers from another goal's retrieved memory appear in the output."
    },
    "ru_gendered_identity_label": {
      "problem": "P9",
      "severity": "medium",
      "description": "A Russian level/achievement title labels the user with a grammatically gendered noun/adjective."
    },
    "ru_gendered_memory_input": {
      "problem": "P9",
      "severity": "low",
      "description": "Stored user memory in the input describes the user with a gendered form."
    },
    "ru_gendered_self_reference": {
      "problem": "P9",
      "severity": "high",
      "description": "The assistant refers to itself with a gendered Russian form (e.g. 'разбил', 'я проверил')."
    },
    "ru_gendered_user_address": {
      "problem": "P9",
      "severity": "high",
      "description": "The user is addressed with a gendered Russian form (e.g. 'вы один', 'вы готов')."
    },
    "ru_informal_address": {
      "problem": "P9",
      "severity": "low",
      "description": "Informal 'ты' in a user-facing answer (product register is 'вы')."
    },
    "sensitive_memory_unflagged": {
      "problem": "P8",
      "severity": "low",
      "description": "Stored memory about health/caregiving/finances is marked sensitive: false."
    },
    "tiny_goal_overplanned": {
      "problem": "P5",
      "severity": "medium",
      "description": "A tiny goal gets more than 4 tasks/nodes."
    },
    "too_many_questions": {
      "problem": "P3",
      "severity": "medium",
      "description": "More than 3 clarification questions, or several questions in a non-clarification answer."
    },
    "unsupported_feasibility_claim": {
      "problem": "P4",
      "severity": "low",
      "description": "Asserts that a date/target still works without the current-state facts needed to know it."
    },
    "unsupported_generalisation": {
      "problem": "P7",
      "severity": "low",
      "description": "Confident generalisation about people/markets/institutions without a source."
    },
    "unverifiable_criterion": {
      "problem": "P2",
      "severity": "low",
      "description": "An acceptance criterion the navigator cannot actually check from the evidence it asks for."
    },
    "user_entered_as_objective": {
      "problem": "P2",
      "severity": "medium",
      "description": "Only user-entered methods are required, yet the protocol is not self-report-only and the ceiling exceeds 'limited'."
    },
    "vague_node_title": {
      "problem": "P1",
      "severity": "medium",
      "description": "Task/outline/added node title is generic (no object or quantity); outline titles are not linted."
    },
    "weekday_date_mismatch": {
      "problem": "X",
      "severity": "high",
      "description": "A weekday named together with a date does not match the calendar."
    }
  },
  "summary": {
    "records_scanned": 93,
    "eval_cases_scanned": 30,
    "findings_total": 122,
    "findings_by_scope": {
      "contrastive": 26,
      "eval_reference": 13,
      "expected_output": 81,
      "input": 2
    },
    "expected_output_findings_by_rule": {
      "capability_assumption": 6,
      "capacity_mismatch": 1,
      "deadline_change_without_consent": 3,
      "novel_quantity": 26,
      "promises_later_message": 1,
      "ru_gendered_identity_label": 6,
      "ru_gendered_self_reference": 1,
      "ru_gendered_user_address": 2,
      "sensitive_memory_unflagged": 1,
      "unsupported_feasibility_claim": 1,
      "unsupported_generalisation": 17,
      "unverifiable_criterion": 1,
      "user_entered_as_objective": 14,
      "weekday_date_mismatch": 1
    },
    "findings_by_problem": {
      "P1": {
        "contrastive:low": 12
      },
      "P2": {
        "eval_reference:medium": 2,
        "expected_output:low": 1,
        "expected_output:medium": 20
      },
      "P3": {
        "contrastive:low": 1
      },
      "P4": {
        "expected_output:low": 1
      },
      "P5": {
        "contrastive:low": 1,
        "expected_output:medium": 1
      },
      "P6": {
        "contrastive:low": 3,
        "expected_output:medium": 3
      },
      "P7": {
        "contrastive:info": 1,
        "contrastive:low": 3,
        "eval_reference:info": 7,
        "eval_reference:low": 3,
        "expected_output:info": 26,
        "expected_output:low": 17
      },
      "P8": {
        "contrastive:low": 1,
        "expected_output:low": 1
      },
      "P9": {
        "contrastive:low": 4,
        "expected_output:high": 3,
        "expected_output:low": 4,
        "expected_output:medium": 2,
        "input:low": 2
      },
      "X": {
        "eval_reference:low": 1,
        "expected_output:high": 1,
        "expected_output:low": 1
      }
    },
    "examples_with_expected_output_findings": 41,
    "known_issues": {
      "high": 6,
      "low": 17,
      "medium": 9
    },
    "known_issue_records": 42
  },
  "findings": [
    {
      "finding_id": "AF-too_many_questions-gj-clar-001-c1-1",
      "rule": "too_many_questions",
      "problem": "P3",
      "severity": "low",
      "scope": "contrastive",
      "record_id": "gj-clar-001-c1",
      "location": "questions",
      "message": "More than 3 clarification questions, or several questions in a non-clarification answer.",
      "evidence": "5 questions"
    },
    {
      "finding_id": "AF-ru_gendered_user_address-gj-clar-007-1",
      "rule": "ru_gendered_user_address",
      "problem": "P9",
      "severity": "high",
      "scope": "expected_output",
      "record_id": "gj-clar-007",
      "location": "message_to_user",
      "message": "The user is addressed with a gendered Russian form (e.g. 'вы один', 'вы готов').",
      "evidence": "… сроку вы хотите переехать и едете ли вы один или с семьёй?\nКонкретные визовые т…"
    },
    {
      "finding_id": "AF-ru_gendered_user_address-gj-clar-007-2",
      "rule": "ru_gendered_user_address",
      "problem": "P9",
      "severity": "high",
      "scope": "expected_output",
      "record_id": "gj-clar-007",
      "location": "questions[1].question",
      "message": "The user is addressed with a gendered Russian form (e.g. 'вы один', 'вы готов').",
      "evidence": "… сроку вы хотите переехать и едете ли один или с семьёй?"
    },
    {
      "finding_id": "AF-generic_rationale-gj-daily-001-c1-1",
      "rule": "generic_rationale",
      "problem": "P1",
      "severity": "low",
      "scope": "contrastive",
      "record_id": "gj-daily-001-c1",
      "location": "recommended_tasks[0].reason",
      "message": "why_it_matters / reason uses a stock phrase that carries no task-specific reason.",
      "evidence": "Important."
    },
    {
      "finding_id": "AF-generic_rationale-gj-daily-001-c1-2",
      "rule": "generic_rationale",
      "problem": "P1",
      "severity": "low",
      "scope": "contrastive",
      "record_id": "gj-daily-001-c1",
      "location": "recommended_tasks[2].reason",
      "message": "why_it_matters / reason uses a stock phrase that carries no task-specific reason.",
      "evidence": "Needed."
    },
    {
      "finding_id": "AF-novel_quantity-gj-feas-001-1",
      "rule": "novel_quantity",
      "problem": "P7",
      "severity": "info",
      "scope": "expected_output",
      "record_id": "gj-feas-001",
      "location": "message_to_user",
      "message": "A quantity with a unit (hours, weeks, %, money) in user-facing text does not appear in the input; confirm it is derived correctly.",
      "evidence": "…е. За 6 месяцев по 15 часов (около 390 часов) можно уверенно освоить Python и в…"
    },
    {
      "finding_id": "AF-novel_quantity-gj-feas-001-2",
      "rule": "novel_quantity",
      "problem": "P7",
      "severity": "info",
      "scope": "expected_output",
      "record_id": "gj-feas-001",